{
  "contract_version": "1",
  "creator_id": "maya-chen",
  "digest": "sha256:a90e737ba71d4aa72ebe1996b6f508c58802969037a9eb7087a6b0975e49ccfa",
  "few_shots": [
    {
      "answer": "State a working interpretation rather than treating the phrase as precise: for example, identify the available clues and the provisional capability they suggest. Explain that the review needs a recruiter note or comparable posting if that ambiguity would alter which experience receives space. Do not copy ‘growth strategy’ as a capability without interpretation.",
      "category": "direct",
      "question": "The posting says only ‘own growth strategy.’ How should the review start?"
    },
    {
      "answer": "Interpret the role for the capability at issue, then log the country-selection claim as not owned and the retention claim as unverified. Keep the narrower, target-relevant mechanism if it is supported. A usable rewrite is: ‘Created the launch-readiness checklist used by local teams for country rollouts.’ Put the retention source and the scope of checklist use into the evidence backlog rather than enlarging the claim.",
      "category": "composed",
      "question": "For a lifecycle-operations role, the candidate wrote: ‘Drove expansion into 10 countries, increasing retention.’ They say leadership chose the countries; they created the launch checklist used by local teams, but do not have the retention source. What should the plan and rewrite do?"
    },
    {
      "answer": "This review cannot choose between jobs. If the user selects one target, it can examine whether the resume presents supportable evidence for that target and identify what needs recovery. Career choice itself needs a different conversation.",
      "category": "boundary",
      "question": "Should I take the product-manager offer or the operations-manager offer?"
    },
    {
      "answer": "No hiring outcome is promised. The deliverable is a defensible resume revision plan and evidence-recovery work for the target role; market conditions and other parts of hiring remain outside this review.",
      "category": "out_of_scope",
      "question": "Can this review ensure that I receive interviews for a senior role?"
    }
  ],
  "product_id": "maya-chen-resume-review",
  "protected_skills": {
    "assets": [
      {
        "id": "skill:maya-chen-resume-review/SKILL.md",
        "path": "maya-chen-resume-review/SKILL.md",
        "sha256": "sha256:ce8ad262a86a8a4178a381ff79f754deb7e4ec7c41fc5281fa940510538f345e"
      }
    ],
    "root": "skills"
  },
  "rag": {
    "documents": [
      {
        "id": "rag:chunks",
        "path": "chunks.json",
        "provenance": "runtime knowledge index",
        "sha256": "sha256:f3e973f1a617d8bdfbf3aab26a585cf370f8f029222b31321f9b4fd6a69e8c0f"
      },
      {
        "id": "rag:documents",
        "path": "documents.json",
        "provenance": "runtime knowledge index",
        "sha256": "sha256:26d10aa9e4e3a27e20f4a92583d5eb246bc6e972102d2671a55e807a1ff0b6ca"
      }
    ],
    "root": "rag"
  },
  "release_id": "maya-chen-resume-review@1.0.0",
  "runtime_policy": {
    "consequential_writes_require_approval": true,
    "delivery_workflow": {
      "audit": {
        "check_product_boundaries": true,
        "coverage": {
          "max_units": 200,
          "require_all_units": true,
          "unitization": "markdown_claim_clauses_v1"
        },
        "evidence_authority": {
          "creator_method_sources": [
            "protected_knowledge"
          ],
          "protected_knowledge_cannot_support_user_specific_claims": true,
          "user_fact_sources": [
            "user_input",
            "approved_tool_evidence"
          ]
        },
        "require_evidence_entailment": true,
        "unit": "atomic_claim",
        "verdicts": [
          "entailed",
          "unsupported",
          "conflicting",
          "confidential",
          "out_of_scope"
        ]
      },
      "audit_instruction": "Audit every supplied claim_inventory unit using the declared evidence-authority classes. Do not omit a unit. Split every factual or causal assertion inside each unit into the minimum necessary atomic claim rows, retaining its unit_id. Keep each claim short and cite only a source ID or short evidence quote; do not restate policy. Mark a claim entailed only when the evidence directly supports it; if any assertion in a unit is unsupported, the unit cannot pass. Plausibility, implication, usage, or adoption is not evidence of an unstated outcome or benefit. User-specific action, scope, ownership, metric, outcome, and causal claims may be supported only by user_input or approved_tool_evidence. protected_knowledge may support the Creator's method, criteria, and advice, but it can never prove a fact about this user. Also enforce every product boundary. Return only the declared JSON result. Runtime computes the final pass from complete coverage and verdicts; do not return a self-reported passed field.",
      "audit_result_format": {
        "claims": [
          {
            "claim": "atomic string",
            "evidence": "string",
            "unit_id": "string from claim_inventory",
            "verdict": "entailed|unsupported|conflicting|confidential|out_of_scope"
          }
        ]
      },
      "expose_intermediate": false,
      "max_revision_passes": 2,
      "mode": "draft_claim_audit_revise",
      "on_unresolved": "return_boundary_safe_partial",
      "revision_instruction": "Revise the draft using the audit findings. Remove or narrow unsupported, conflicting, confidential, or out-of-scope claims, or move them into an explicit evidence gap when useful. Keep evidence authority separate: protected knowledge may shape the method or advice but may not supply a fact about the user. Do not add a replacement fact, rationale, effect, example, or causal bridge that is not directly supported. Return only the revised Consumer deliverable.",
      "version": "1"
    },
    "external_tools": [],
    "local_tools": [
      "fs.read",
      "fs.write"
    ],
    "workspace_scoped": true
  },